{
  "schema_version": 1,
  "diagram_type": "lifecycle",
  "meta": {
    "id": "invoice.lifecycle",
    "title": "An invoice, month by month",
    "subtitle": "A short cycle drawn top-to-bottom, for contrast with the parcel journey",
    "subject": "Invoice.status",
    "repository": { "url": "https://github.com/example/relay", "revision": "main" }
  },
  "layout": { "direction": "tb" },
  "states": [
    { "id": "draft", "label": "Draft", "kind": "initial", "actor": "system", "description": "Accruing lines as parcels are delivered" },
    { "id": "issued", "label": "Issued", "kind": "waiting", "actor": "merchant", "description": "Sent, and waiting on the merchant's terms" },
    { "id": "part_paid", "label": "Part paid", "actor": "merchant", "description": "Some money arrived, a balance remains" },
    { "id": "overdue", "label": "Overdue", "kind": "failure", "actor": "credit control", "description": "Past its due date with a balance outstanding" },
    { "id": "paid", "label": "Paid", "kind": "terminal", "description": "Settled in full" },
    { "id": "written_off", "label": "Written off", "kind": "terminal", "description": "Given up on, and the account put on hold" }
  ],
  "transitions": [
    { "id": "issue", "from": "draft", "to": "issued", "event": "month closes", "actor": "system", "kind": "auto", "guard": "the invoice has at least one line", "action": "email the merchant and start the terms clock" },
    { "id": "settle", "from": "issued", "to": "paid", "event": "payment matches the total", "actor": "banking partner" },
    { "id": "partial", "from": "issued", "to": "part_paid", "event": "payment is less than the total", "actor": "banking partner", "action": "email a statement of the balance" },
    { "id": "clear", "from": "part_paid", "to": "paid", "event": "balance reaches zero", "actor": "banking partner" },
    { "id": "lapse", "from": "issued", "to": "overdue", "event": "due date passes", "actor": "system", "kind": "timeout", "action": "notify credit control" },
    { "id": "lapse-partial", "from": "part_paid", "to": "overdue", "event": "due date passes", "actor": "system", "kind": "timeout" },
    { "id": "recover", "from": "overdue", "to": "paid", "event": "balance recovered", "actor": "credit control", "action": "release the account hold" },
    { "id": "give-up", "from": "overdue", "to": "written_off", "event": "90 days overdue", "actor": "credit control", "kind": "timeout", "action": "suspend the account" }
  ],
  "cards": [
    { "title": "Drawn differently on purpose", "tone": "info", "items": ["Top-to-bottom, because a billing cycle reads as a sequence of months rather than a journey through a network", "Six states against the parcel journey's twelve — the same renderer, a very different shape"] }
  ]
}
