{
  "schema_version": 1,
  "diagram_type": "lifecycle",
  "meta": {
    "id": "parcel.lifecycle",
    "title": "The journey of a parcel",
    "subtitle": "Every state a parcel can reach, and the only moves between them",
    "subject": "Parcel.status",
    "repository": {
      "url": "https://github.com/example/relay",
      "revision": "main"
    }
  },
  "states": [
    {
      "id": "created",
      "label": "Created",
      "kind": "initial",
      "actor": "merchant",
      "description": "Booked and labelled, still on the merchant's shelf",
      "sources": [
        {
          "path": "src/parcel/parcel.state.ts",
          "line": 12
        }
      ]
    },
    {
      "id": "collected",
      "label": "Collected",
      "actor": "courier",
      "description": "In Relay's hands, not yet sorted"
    },
    {
      "id": "at_depot",
      "label": "At depot",
      "actor": "system",
      "description": "Sorted and waiting for the next leg"
    },
    {
      "id": "in_transit",
      "label": "In transit",
      "actor": "system",
      "description": "On a trunk vehicle between two depots"
    },
    {
      "id": "out_for_delivery",
      "label": "Out for delivery",
      "actor": "courier",
      "description": "On a van, with a sequenced stop and a promised window"
    },
    {
      "id": "attempt_failed",
      "label": "Attempt failed",
      "kind": "failure",
      "actor": "system",
      "description": "Nobody in, or no safe place. Back to the depot tonight."
    },
    {
      "id": "awaiting_instruction",
      "label": "Awaiting instruction",
      "kind": "waiting",
      "actor": "recipient",
      "description": "Parked until the recipient chooses what happens next"
    },
    {
      "id": "returning",
      "label": "Returning",
      "actor": "system",
      "description": "Heading back to the merchant"
    },
    {
      "id": "delivered",
      "label": "Delivered",
      "kind": "terminal",
      "description": "Handed over, or left in the agreed safe place with a photo"
    },
    {
      "id": "returned",
      "label": "Returned",
      "kind": "terminal",
      "description": "Back with the merchant. Charged as a failed delivery."
    },
    {
      "id": "cancelled",
      "label": "Cancelled",
      "kind": "terminal",
      "description": "Withdrawn before Relay ever took it"
    },
    {
      "id": "lost",
      "label": "Lost",
      "kind": "failure",
      "description": "No scan for ten days. A claim is opened automatically."
    }
  ],
  "transitions": [
    {
      "id": "collect",
      "from": "created",
      "to": "collected",
      "event": "collection scan",
      "actor": "courier",
      "action": "start the clock on the service promise"
    },
    {
      "id": "cancel",
      "from": "created",
      "to": "cancelled",
      "event": "cancel",
      "actor": "merchant",
      "guard": "no scan has been taken",
      "action": "void the label"
    },
    {
      "id": "inbound-first",
      "from": "collected",
      "to": "at_depot",
      "event": "depot_inbound scan",
      "actor": "courier"
    },
    {
      "id": "outbound",
      "from": "at_depot",
      "to": "in_transit",
      "event": "depot_outbound scan",
      "actor": "system",
      "guard": "the destination depot is not this one"
    },
    {
      "id": "inbound-next",
      "from": "in_transit",
      "to": "at_depot",
      "event": "depot_inbound scan",
      "actor": "courier"
    },
    {
      "id": "load",
      "from": "at_depot",
      "to": "out_for_delivery",
      "event": "vehicle_load scan",
      "actor": "courier",
      "guard": "a stop exists on today's route",
      "action": "text the recipient their two-hour window"
    },
    {
      "id": "deliver",
      "from": "out_for_delivery",
      "to": "delivered",
      "event": "delivery scan",
      "actor": "courier",
      "action": "publish parcel.delivered and notify the merchant"
    },
    {
      "id": "fail",
      "from": "out_for_delivery",
      "to": "attempt_failed",
      "event": "attempt_failed scan",
      "actor": "courier",
      "kind": "failure",
      "action": "record the reason and a doorstep photo"
    },
    {
      "id": "retry",
      "from": "attempt_failed",
      "to": "out_for_delivery",
      "event": "next working day",
      "actor": "system",
      "kind": "auto",
      "guard": "fewer than two attempts used",
      "action": "add a stop to tomorrow's route"
    },
    {
      "id": "exhausted",
      "from": "attempt_failed",
      "to": "awaiting_instruction",
      "event": "two attempts used",
      "actor": "system",
      "kind": "auto",
      "action": "text the recipient their options"
    },
    {
      "id": "reschedule",
      "from": "awaiting_instruction",
      "to": "out_for_delivery",
      "event": "reschedule or redirect",
      "actor": "recipient",
      "action": "book the chosen day and confirm by SMS"
    },
    {
      "id": "give-up",
      "from": "awaiting_instruction",
      "to": "returning",
      "event": "five working days elapsed",
      "actor": "system",
      "kind": "timeout",
      "action": "notify the merchant that it is coming back"
    },
    {
      "id": "return-done",
      "from": "returning",
      "to": "returned",
      "event": "return scan at origin depot",
      "actor": "courier",
      "action": "raise the return charge"
    },
    {
      "id": "lost-transit",
      "from": "in_transit",
      "to": "lost",
      "event": "ten days without a scan",
      "actor": "system",
      "kind": "timeout"
    },
    {
      "id": "lost-depot",
      "from": "at_depot",
      "to": "lost",
      "event": "ten days without a scan",
      "actor": "system",
      "kind": "timeout",
      "action": "open a claim and credit the merchant"
    },
    {
      "id": "found",
      "from": "lost",
      "to": "at_depot",
      "event": "any scan",
      "actor": "courier",
      "action": "close the claim as found"
    }
  ],
  "cards": [
    {
      "title": "Why it is shaped like this",
      "tone": "info",
      "items": [
        "Two delivery attempts, then the parcel stops moving until a human decides \u2014 vans are the scarce resource, not warehouse shelves",
        "Lost is recoverable: parcels turn up, and a found parcel rejoins at the depot that scanned it"
      ]
    },
    {
      "title": "Watch out",
      "tone": "warning",
      "items": [
        "Scans arrive out of order from offline handhelds, so a transition can be evaluated against a scan older than the current state",
        "Only a scan moves a parcel forward. There is no manual status edit, by design."
      ]
    }
  ]
}
